{
  "$schema": "../Schemas/generator-graph.schema.json",
  "schema": "moyva.generator-graph",
  "version": 2,
  "id": "testgeneratorgraph",
  "model": "graph",
  "nodes": [
    {
      "$type": "seed",
      "seed": 659071469,
      "nodeId": "0e244104-f5c0-46dd-9310-026029a2b3d9",
      "editorPosition": {
        "x": 50.0,
        "y": 164.0
      },
      "layerId": ""
    },
    {
      "$type": "tile-settings",
      "tileType": {
        "$config": {
          "model": "tile-type",
          "id": "water"
        }
      },
      "nodeId": "8e548288-2314-477d-908b-beb1a4df333b",
      "editorPosition": {
        "x": 542.0,
        "y": -361.0
      },
      "layerId": "1d3eead6-7c79-4cf9-99b0-2fbeabc8333b"
    },
    {
      "$type": "output",
      "outputKind": "Tiles",
      "nodeId": "fc6d7ee3-c0de-4205-acae-3972b0935db2",
      "editorPosition": {
        "x": 613.0,
        "y": 41.0
      },
      "layerId": "1d3eead6-7c79-4cf9-99b0-2fbeabc8333b"
    },
    {
      "$type": "twc-modifier",
      "modifierTypeName": "GiantGrey.TileWorldCreator.DotGrid",
      "modifier": {
        "$type": "GiantGrey.TileWorldCreator.DotGrid",
        "asset": null,
        "isEnabled": true,
        "gridSpace": 1
      },
      "nodeId": "05baf276-9ac8-4c91-b52c-d4104d61ea24",
      "editorPosition": {
        "x": 51.0,
        "y": -153.0
      },
      "layerId": "1d3eead6-7c79-4cf9-99b0-2fbeabc8333b"
    },
    {
      "$type": "output",
      "outputKind": "Masks",
      "nodeId": "486d1abc-45a6-4738-adf6-200d1acfe0d2",
      "editorPosition": {
        "x": 1787.0,
        "y": -214.0
      },
      "layerId": "b47a1390-a46d-4999-9780-f5e2769e8668"
    },
    {
      "$type": "layer-mask-reference",
      "sourceLayerId": "b47a1390-a46d-4999-9780-f5e2769e8668",
      "nodeId": "75960c0b-68a0-4d21-a47e-2321f8dd7e05",
      "editorPosition": {
        "x": 11.0,
        "y": -145.0
      },
      "layerId": "78af69b7-740e-4a85-bad4-866f58c4c7c7"
    },
    {
      "$type": "output",
      "outputKind": "Tiles",
      "nodeId": "8ea81672-f9b8-4f42-8c96-066756cc483e",
      "editorPosition": {
        "x": 993.0,
        "y": -138.0
      },
      "layerId": "78af69b7-740e-4a85-bad4-866f58c4c7c7"
    },
    {
      "$type": "tile-settings",
      "tileType": {
        "$config": {
          "model": "tile-type",
          "id": "sand"
        }
      },
      "nodeId": "0445ecb4-6dd2-486a-863e-967914603e56",
      "editorPosition": {
        "x": 597.0,
        "y": -509.0
      },
      "layerId": "78af69b7-740e-4a85-bad4-866f58c4c7c7"
    },
    {
      "$type": "layer-mask-reference",
      "sourceLayerId": "b47a1390-a46d-4999-9780-f5e2769e8668",
      "nodeId": "010f3396-90bd-435d-9742-d49445c661d5",
      "editorPosition": {
        "x": 374.0,
        "y": 248.0
      },
      "layerId": "f904bc0b-b8b6-4fdc-b371-76921129c59b"
    },
    {
      "$type": "output",
      "outputKind": "Tiles",
      "nodeId": "08cc76ec-74ce-4f85-9cce-3371ce5fdc43",
      "editorPosition": {
        "x": 1970.0,
        "y": 164.0
      },
      "layerId": "f904bc0b-b8b6-4fdc-b371-76921129c59b"
    },
    {
      "$type": "tile-settings",
      "tileType": {
        "$config": {
          "model": "tile-type",
          "id": "grass"
        }
      },
      "nodeId": "034dc077-548f-4574-9724-37b068410663",
      "editorPosition": {
        "x": 2022.0,
        "y": -189.0
      },
      "layerId": "f904bc0b-b8b6-4fdc-b371-76921129c59b"
    },
    {
      "$type": "perlin-noise-mask",
      "scale": 30.0,
      "octaves": 5,
      "persistence": 0.683,
      "lacunarity": 2.0,
      "offset": {
        "x": 0.0,
        "y": 0.0
      },
      "threshold": 0.468,
      "nodeId": "dd90da81-68fe-4815-a050-f0580322f670",
      "editorPosition": {
        "x": 363.0,
        "y": 189.0
      },
      "layerId": "b47a1390-a46d-4999-9780-f5e2769e8668"
    },
    {
      "$type": "twc-modifier",
      "modifierTypeName": "GiantGrey.TileWorldCreator.Smooth",
      "modifier": {
        "$type": "GiantGrey.TileWorldCreator.Smooth",
        "asset": null,
        "isEnabled": true,
        "smoothCount": 2
      },
      "nodeId": "144797c1-49ae-41ed-8758-53104d48748f",
      "editorPosition": {
        "x": 1296.0,
        "y": -10.0
      },
      "layerId": "b47a1390-a46d-4999-9780-f5e2769e8668"
    },
    {
      "$type": "twc-modifier",
      "modifierTypeName": "GiantGrey.TileWorldCreator.CellularAutomata",
      "modifier": {
        "$type": "GiantGrey.TileWorldCreator.CellularAutomata",
        "asset": null,
        "isEnabled": true,
        "fillProbability": 0.5,
        "smoothingSteps": 5,
        "ensureConnected": false,
        "useMapSize": true,
        "position": {
          "x": 0,
          "y": 0
        },
        "customWidth": 5,
        "customHeight": 5
      },
      "nodeId": "2155eb18-99f0-473f-9bb1-f33205189b6f",
      "editorPosition": {
        "x": 380.0,
        "y": -123.0
      },
      "layerId": "b47a1390-a46d-4999-9780-f5e2769e8668"
    },
    {
      "$type": "add",
      "mode": "AddOrMerge",
      "valueKind": "Any",
      "nodeId": "03917561-821b-4cd4-8f7f-8a99d3fc2b90",
      "editorPosition": {
        "x": 875.0,
        "y": -41.0
      },
      "layerId": "b47a1390-a46d-4999-9780-f5e2769e8668"
    },
    {
      "$type": "twc-modifier",
      "modifierTypeName": "GiantGrey.TileWorldCreator.Shrink",
      "modifier": {
        "$type": "GiantGrey.TileWorldCreator.Shrink",
        "asset": null,
        "isEnabled": true,
        "shrinkCount": 2
      },
      "nodeId": "4d487cb0-4c28-46b0-89b4-810bf746340e",
      "editorPosition": {
        "x": 839.0,
        "y": 363.0
      },
      "layerId": "f904bc0b-b8b6-4fdc-b371-76921129c59b"
    },
    {
      "$type": "twc-modifier",
      "modifierTypeName": "GiantGrey.TileWorldCreator.Smooth",
      "modifier": {
        "$type": "GiantGrey.TileWorldCreator.Smooth",
        "asset": null,
        "isEnabled": true,
        "smoothCount": 5
      },
      "nodeId": "01a3834d-6589-4f5d-8d95-0edde7479689",
      "editorPosition": {
        "x": 1262.0,
        "y": 364.0
      },
      "layerId": "f904bc0b-b8b6-4fdc-b371-76921129c59b"
    }
  ],
  "connections": [
    {
      "connectionId": "9461b23c-2bf8-4d8e-9817-c3f8952b5786",
      "sourceNodeId": "05baf276-9ac8-4c91-b52c-d4104d61ea24",
      "sourcePortIndex": 0,
      "targetNodeId": "8e548288-2314-477d-908b-beb1a4df333b",
      "targetPortIndex": 0,
      "sourceElementIndex": 0
    },
    {
      "connectionId": "94863176-9a2d-4e5e-b77e-99ce9e93dc56",
      "sourceNodeId": "05baf276-9ac8-4c91-b52c-d4104d61ea24",
      "sourcePortIndex": 0,
      "targetNodeId": "fc6d7ee3-c0de-4205-acae-3972b0935db2",
      "targetPortIndex": 4,
      "sourceElementIndex": 0
    },
    {
      "connectionId": "c8aaefb4-e047-4c62-a6c8-7d4b09553951",
      "sourceNodeId": "75960c0b-68a0-4d21-a47e-2321f8dd7e05",
      "sourcePortIndex": 0,
      "targetNodeId": "0445ecb4-6dd2-486a-863e-967914603e56",
      "targetPortIndex": 0,
      "sourceElementIndex": 0
    },
    {
      "connectionId": "f3f75fc6-9035-415c-bb32-ea3ede90d0fd",
      "sourceNodeId": "144797c1-49ae-41ed-8758-53104d48748f",
      "sourcePortIndex": 0,
      "targetNodeId": "486d1abc-45a6-4738-adf6-200d1acfe0d2",
      "targetPortIndex": 4,
      "sourceElementIndex": 0
    },
    {
      "connectionId": "30197920-2630-47a4-acce-94da056f0eec",
      "sourceNodeId": "75960c0b-68a0-4d21-a47e-2321f8dd7e05",
      "sourcePortIndex": 0,
      "targetNodeId": "8ea81672-f9b8-4f42-8c96-066756cc483e",
      "targetPortIndex": 4,
      "sourceElementIndex": 0
    },
    {
      "connectionId": "a58c8b36-8381-487b-b0c6-7b932856f4f1",
      "sourceNodeId": "dd90da81-68fe-4815-a050-f0580322f670",
      "sourcePortIndex": 0,
      "targetNodeId": "03917561-821b-4cd4-8f7f-8a99d3fc2b90",
      "targetPortIndex": 1,
      "sourceElementIndex": 0
    },
    {
      "connectionId": "a3b2c1ec-1615-4d95-8334-011e50ea1937",
      "sourceNodeId": "2155eb18-99f0-473f-9bb1-f33205189b6f",
      "sourcePortIndex": 0,
      "targetNodeId": "03917561-821b-4cd4-8f7f-8a99d3fc2b90",
      "targetPortIndex": 0,
      "sourceElementIndex": 0
    },
    {
      "connectionId": "cffd1e71-5346-4ae0-9d78-6db828d07b69",
      "sourceNodeId": "03917561-821b-4cd4-8f7f-8a99d3fc2b90",
      "sourcePortIndex": 0,
      "targetNodeId": "144797c1-49ae-41ed-8758-53104d48748f",
      "targetPortIndex": 0,
      "sourceElementIndex": 0
    },
    {
      "connectionId": "1c3c1dfb-f61d-47e1-885e-b81b8bec430c",
      "sourceNodeId": "010f3396-90bd-435d-9742-d49445c661d5",
      "sourcePortIndex": 0,
      "targetNodeId": "4d487cb0-4c28-46b0-89b4-810bf746340e",
      "targetPortIndex": 0,
      "sourceElementIndex": 0
    },
    {
      "connectionId": "29441c9d-50fc-4bce-ab48-8febea355b5d",
      "sourceNodeId": "4d487cb0-4c28-46b0-89b4-810bf746340e",
      "sourcePortIndex": 0,
      "targetNodeId": "01a3834d-6589-4f5d-8d95-0edde7479689",
      "targetPortIndex": 0,
      "sourceElementIndex": 0
    },
    {
      "connectionId": "ee3fd1c2-4514-4780-b259-578c6ceb4a12",
      "sourceNodeId": "01a3834d-6589-4f5d-8d95-0edde7479689",
      "sourcePortIndex": 0,
      "targetNodeId": "08cc76ec-74ce-4f85-9cce-3371ce5fdc43",
      "targetPortIndex": 4,
      "sourceElementIndex": 0
    },
    {
      "connectionId": "f8e31755-2a0a-4cdd-a564-953fe13ebce3",
      "sourceNodeId": "01a3834d-6589-4f5d-8d95-0edde7479689",
      "sourcePortIndex": 0,
      "targetNodeId": "034dc077-548f-4574-9724-37b068410663",
      "targetPortIndex": 0,
      "sourceElementIndex": 0
    }
  ],
  "sharedSettings": {
    "mapWidth": 0,
    "mapHeight": 0,
    "gridTopology": "Orthogonal",
    "projectionMode": "0",
    "renderMode": "0",
    "neighborhoodMode": "Auto"
  },
  "globalGraphState": {
    "graphId": "150b897f-192f-4088-bc61-2c81fcce45f7",
    "layerId": "",
    "version": 1,
    "nodeIds": [